caption,caption_opp,image_path,image_opp_path,classifier_equivalence,classifier_equivalence_opp
lines of migrants walk along the railway lines this morning after a night of violence which saw a police officer badly injured,lines of migrants walk along the railway lines this morning after a night of violence which saw a police officer badly uninjured,Data/conceptual_captions_data/processed_success/fe9c0edc-3df4-46d0-b8b2-de40e4793b43/fe9c0edc-3df4-46d0-b8b2-de40e4793b43_sd_image.png,Data/conceptual_captions_data/processed_success/fe9c0edc-3df4-46d0-b8b2-de40e4793b43/fe9c0edc-3df4-46d0-b8b2-de40e4793b43_sd_image_opp.png,no,no
"cool green frog jumping out of joy because it is in love , clenching its eyes , extending its arms and legs and showing a red heart above its head","cool green frog jumping out of sorrow because it is in love , clenching its eyes , extending its arms and legs and showing a red heart above its head",Data/conceptual_captions_data/processed_success/5e7a9814-4b1e-48fc-be39-e904d87625c7/5e7a9814-4b1e-48fc-be39-e904d87625c7_sd_image.png,Data/conceptual_captions_data/processed_success/5e7a9814-4b1e-48fc-be39-e904d87625c7/5e7a9814-4b1e-48fc-be39-e904d87625c7_sd_image_opp.png,no,no
feeling gleeful : judge looked delighted to be one of the famous faces at the annual awards show,feeling gleeful : judge looked displease to be one of the famous faces at the annual awards show,Data/conceptual_captions_data/processed_success/106c2345-3400-4c52-a0cd-03080de2f71c/106c2345-3400-4c52-a0cd-03080de2f71c_sd_image.png,Data/conceptual_captions_data/processed_success/106c2345-3400-4c52-a0cd-03080de2f71c/106c2345-3400-4c52-a0cd-03080de2f71c_sd_image_opp.png,no,no
actor of all my actors that i like i would love to kiss this guy !,actor of all my actors that i like i would hate to kiss this guy !,Data/conceptual_captions_data/processed_success/48b597be-e74c-4365-8fa5-5501146323fd/48b597be-e74c-4365-8fa5-5501146323fd_sd_image.png,Data/conceptual_captions_data/processed_success/48b597be-e74c-4365-8fa5-5501146323fd/48b597be-e74c-4365-8fa5-5501146323fd_sd_image_opp.png,no,no
cartoon illustration of hand drawing of a smiling moon and the stars wishing good night in the starry sky .,cartoon illustration of hand drawing of a smiling moon and the stars wishing good day in the starry sky .,Data/conceptual_captions_data/processed_success/aec572d2-8db2-40c3-accf-5dd29ebc67d9/aec572d2-8db2-40c3-accf-5dd29ebc67d9_sd_image.png,Data/conceptual_captions_data/processed_success/aec572d2-8db2-40c3-accf-5dd29ebc67d9/aec572d2-8db2-40c3-accf-5dd29ebc67d9_sd_image_opp.png,no,no
4k attractive woman celebrates her birthday with friends at a party and blows out the candles on her birthday cake,4k unattractive woman celebrates her birthday with friends at a party and blows out the candles on her birthday cake,Data/conceptual_captions_data/processed_success/f0098f23-aede-40da-8078-0bf5a210a695/f0098f23-aede-40da-8078-0bf5a210a695_sd_image.png,Data/conceptual_captions_data/processed_success/f0098f23-aede-40da-8078-0bf5a210a695/f0098f23-aede-40da-8078-0bf5a210a695_sd_image_opp.png,no,no
"sports league championship day -- in olympic athlete stands confidently astride on the mat after successfully clearingm in the high jump , a season 's best jump after coming back from injury","sports league championship day -- in olympic athlete sit confidently astride on the mat after successfully clearingm in the high jump , a season 's best jump after coming back from injury",Data/conceptual_captions_data/processed_success/582137b2-ee97-4d68-a91a-b8fc6341216e/582137b2-ee97-4d68-a91a-b8fc6341216e_sd_image.png,Data/conceptual_captions_data/processed_success/582137b2-ee97-4d68-a91a-b8fc6341216e/582137b2-ee97-4d68-a91a-b8fc6341216e_sd_image_opp.png,no,no
see the most glamorous beauty and hair looks from awards,see the most glamorous ugliness and hair looks from awards,Data/conceptual_captions_data/processed_success/f7955cf1-63cc-4b6a-b82f-9b821584d934/f7955cf1-63cc-4b6a-b82f-9b821584d934_sd_image.png,Data/conceptual_captions_data/processed_success/f7955cf1-63cc-4b6a-b82f-9b821584d934/f7955cf1-63cc-4b6a-b82f-9b821584d934_sd_image_opp.png,no,no
"a man suffering from severe depression , sitting on some train tracks","a man enjoy from severe depression , sitting on some train tracks",Data/conceptual_captions_data/processed_success/a2e90ebf-def2-48b0-82ea-52330acc042c/a2e90ebf-def2-48b0-82ea-52330acc042c_sd_image.png,Data/conceptual_captions_data/processed_success/a2e90ebf-def2-48b0-82ea-52330acc042c/a2e90ebf-def2-48b0-82ea-52330acc042c_sd_image_opp.png,yes,no
"copper , with its rich patina , is an attractive alternative to iron , and it 's getting popular .","copper , with its rich patina , is an attractive alternative to iron , and it 's getting unpopular .",Data/conceptual_captions_data/processed_success/fdbad3e4-44bf-45ce-9613-a5f557c574d0/fdbad3e4-44bf-45ce-9613-a5f557c574d0_sd_image.png,Data/conceptual_captions_data/processed_success/fdbad3e4-44bf-45ce-9613-a5f557c574d0/fdbad3e4-44bf-45ce-9613-a5f557c574d0_sd_image_opp.png,no,yes
inspire the kids to play outside more by creating these easy that feature their favorite things to do !,inspire the kids to play outside more by creating these difficult that feature their favorite things to do !,Data/conceptual_captions_data/processed_success/4a9e0b56-67a1-421e-b8d9-5cc0b4fb1566/4a9e0b56-67a1-421e-b8d9-5cc0b4fb1566_sd_image.png,Data/conceptual_captions_data/processed_success/4a9e0b56-67a1-421e-b8d9-5cc0b4fb1566/4a9e0b56-67a1-421e-b8d9-5cc0b4fb1566_sd_image_opp.png,no,no
"melancholy - this came from the site , but link is broken and image search strikes out .","melancholy - this go from the site , but link is broken and image search strikes out .",Data/conceptual_captions_data/processed_success/1e1fa511-9819-462c-9272-e2cddc98643d/1e1fa511-9819-462c-9272-e2cddc98643d_sd_image.png,Data/conceptual_captions_data/processed_success/1e1fa511-9819-462c-9272-e2cddc98643d/1e1fa511-9819-462c-9272-e2cddc98643d_sd_image_opp.png,yes,yes
always a good idea to have a great wine when decorating for a holiday !,always a evil idea to have a great wine when decorating for a holiday !,Data/conceptual_captions_data/processed_success/726a2944-eef0-42d4-b8fd-ad921829bcba/726a2944-eef0-42d4-b8fd-ad921829bcba_sd_image.png,Data/conceptual_captions_data/processed_success/726a2944-eef0-42d4-b8fd-ad921829bcba/726a2944-eef0-42d4-b8fd-ad921829bcba_sd_image_opp.png,no,no
"you 'd better know person in a recent photography by person person is a very attractive guy , with charming eyes and fit toned male , in this session we can appreciate all .","you 'd better know person in a recent photography by person person is a very attractive guy , with charming eyes and fit toned male , in this session we can depreciate all .",Data/conceptual_captions_data/processed_success/32a3ba70-00b7-47f3-93a1-1238a7566f00/32a3ba70-00b7-47f3-93a1-1238a7566f00_sd_image.png,Data/conceptual_captions_data/processed_success/32a3ba70-00b7-47f3-93a1-1238a7566f00/32a3ba70-00b7-47f3-93a1-1238a7566f00_sd_image_opp.png,no,no
teammates walk off the floor as reading celebrates their win in the championship .,teammates walk on the floor as reading celebrates their win in the championship .,Data/conceptual_captions_data/processed_success/1461687b-9d6a-4bec-8f33-de4311c2b09d/1461687b-9d6a-4bec-8f33-de4311c2b09d_sd_image.png,Data/conceptual_captions_data/processed_success/1461687b-9d6a-4bec-8f33-de4311c2b09d/1461687b-9d6a-4bec-8f33-de4311c2b09d_sd_image_opp.png,no,no
beautiful iceberg on a clear sunny day .,ugly iceberg on a clear sunny day .,Data/conceptual_captions_data/processed_success/752fce52-ba3f-45a8-ab53-e3989225d71e/752fce52-ba3f-45a8-ab53-e3989225d71e_sd_image.png,Data/conceptual_captions_data/processed_success/752fce52-ba3f-45a8-ab53-e3989225d71e/752fce52-ba3f-45a8-ab53-e3989225d71e_sd_image_opp.png,no,no
"young caucasian bearded businessman in grey sweatshirt sitting behind his desk and using smart phone , working in a bright office with a white brick wall looking confident satisfied and successful","young caucasian bearded businessman in grey sweatshirt sitting behind his desk and using smart phone , working in a bright office with a white brick wall looking confident fall_short_of and successful",Data/conceptual_captions_data/processed_success/8ec31462-3409-490f-80da-06bcbd1cc170/8ec31462-3409-490f-80da-06bcbd1cc170_sd_image.png,Data/conceptual_captions_data/processed_success/8ec31462-3409-490f-80da-06bcbd1cc170/8ec31462-3409-490f-80da-06bcbd1cc170_sd_image_opp.png,no,no
happy romantic couple relaxing enjoying beautiful sunset at the beach,happy romantic couple relaxing enjoying ugly sunset at the beach,Data/conceptual_captions_data/processed_success/10deb912-8917-4f97-ac04-8f7139a09d4d/10deb912-8917-4f97-ac04-8f7139a09d4d_sd_image.png,Data/conceptual_captions_data/processed_success/10deb912-8917-4f97-ac04-8f7139a09d4d/10deb912-8917-4f97-ac04-8f7139a09d4d_sd_image_opp.png,no,no
beautiful baby girl with a sweet smile,ugly baby girl with a sweet smile,Data/conceptual_captions_data/processed_success/1f45414e-f2b0-4f45-bcf7-8ec1be32e284/1f45414e-f2b0-4f45-bcf7-8ec1be32e284_sd_image.png,Data/conceptual_captions_data/processed_success/1f45414e-f2b0-4f45-bcf7-8ec1be32e284/1f45414e-f2b0-4f45-bcf7-8ec1be32e284_sd_image_opp.png,no,no
"twice as nice : other actors to win the title include actors , both of whom have won twice","twice as nasty : other actors to win the title include actors , both of whom have won twice",Data/conceptual_captions_data/processed_success/0504236e-190b-44f5-bdd5-aa106c0549da/0504236e-190b-44f5-bdd5-aa106c0549da_sd_image.png,Data/conceptual_captions_data/processed_success/0504236e-190b-44f5-bdd5-aa106c0549da/0504236e-190b-44f5-bdd5-aa106c0549da_sd_image_opp.png,no,no
mask and eagle with artistic pattern for a beautiful tribal full back tattoo fit for a strong bold personality .,mask and eagle with artistic pattern for a ugly tribal full back tattoo fit for a strong bold personality .,Data/conceptual_captions_data/processed_success/8e5e1d56-cefb-4df0-9af8-e1a91f9dd8a7/8e5e1d56-cefb-4df0-9af8-e1a91f9dd8a7_sd_image.png,Data/conceptual_captions_data/processed_success/8e5e1d56-cefb-4df0-9af8-e1a91f9dd8a7/8e5e1d56-cefb-4df0-9af8-e1a91f9dd8a7_sd_image_opp.png,no,no
visitors relaxing on a bench and enjoying the sunshine,visitors relaxing on a bench and suffer the sunshine,Data/conceptual_captions_data/processed_success/85e12088-51c5-437a-a9ca-7862883932e8/85e12088-51c5-437a-a9ca-7862883932e8_sd_image.png,Data/conceptual_captions_data/processed_success/85e12088-51c5-437a-a9ca-7862883932e8/85e12088-51c5-437a-a9ca-7862883932e8_sd_image_opp.png,no,no
there are fears driverless cars and drones could also be used by cyber attackers or thieves,there are fearlessness driverless cars and drones could also be used by cyber attackers or thieves,Data/conceptual_captions_data/processed_success/58c772e8-fea4-4be6-8984-1a9dd816eb7c/58c772e8-fea4-4be6-8984-1a9dd816eb7c_sd_image.png,Data/conceptual_captions_data/processed_success/58c772e8-fea4-4be6-8984-1a9dd816eb7c/58c772e8-fea4-4be6-8984-1a9dd816eb7c_sd_image_opp.png,no,no
happy couple or friends hugging on the street after encounter,unhappy couple or friends hugging on the street after encounter,Data/conceptual_captions_data/processed_success/f3af1a65-6da6-4743-9dea-9522248d4e4f/f3af1a65-6da6-4743-9dea-9522248d4e4f_sd_image.png,Data/conceptual_captions_data/processed_success/f3af1a65-6da6-4743-9dea-9522248d4e4f/f3af1a65-6da6-4743-9dea-9522248d4e4f_sd_image_opp.png,no,no
a cup of coffee shared with a friend is happiness tasted and time well spent .,a cup of coffee shared with a friend is unhappiness tasted and time well spent .,Data/conceptual_captions_data/processed_success/83a63564-0a75-448b-93fc-f727c9c94cd7/83a63564-0a75-448b-93fc-f727c9c94cd7_sd_image.png,Data/conceptual_captions_data/processed_success/83a63564-0a75-448b-93fc-f727c9c94cd7/83a63564-0a75-448b-93fc-f727c9c94cd7_sd_image_opp.png,no,no
person beautiful smile with a kind heart .,person ugly smile with a kind heart .,Data/conceptual_captions_data/processed_success/f3dcdfe7-b463-4564-87ca-918d8efa0de5/f3dcdfe7-b463-4564-87ca-918d8efa0de5_sd_image.png,Data/conceptual_captions_data/processed_success/f3dcdfe7-b463-4564-87ca-918d8efa0de5/f3dcdfe7-b463-4564-87ca-918d8efa0de5_sd_image_opp.png,no,no
silhouette of a happy little girl child running into the arms of his loving mother for a hug,silhouette of a happy little girl child running into the arms of his hate mother for a hug,Data/conceptual_captions_data/processed_success/2badd873-240e-43cb-a2bf-7efdde3de821/2badd873-240e-43cb-a2bf-7efdde3de821_sd_image.png,Data/conceptual_captions_data/processed_success/2badd873-240e-43cb-a2bf-7efdde3de821/2badd873-240e-43cb-a2bf-7efdde3de821_sd_image_opp.png,no,no
actor : promoted his career as a good looking romantic leading man but also a family man and nice guy -- all of which happened to be true !,actor : demote his career as a good looking romantic leading man but also a family man and nice guy -- all of which happened to be true !,Data/conceptual_captions_data/processed_success/f4a682f0-50d8-4361-b5b7-122d3ad48489/f4a682f0-50d8-4361-b5b7-122d3ad48489_sd_image.png,Data/conceptual_captions_data/processed_success/f4a682f0-50d8-4361-b5b7-122d3ad48489/f4a682f0-50d8-4361-b5b7-122d3ad48489_sd_image_opp.png,no,no
portrait of a beautiful young woman with creative hairstyle and bright colored eye makeup .,portrait of a ugly young woman with creative hairstyle and bright colored eye makeup .,Data/conceptual_captions_data/processed_success/d2dfe187-661e-4e7a-b739-24fca107e045/d2dfe187-661e-4e7a-b739-24fca107e045_sd_image.png,Data/conceptual_captions_data/processed_success/d2dfe187-661e-4e7a-b739-24fca107e045/d2dfe187-661e-4e7a-b739-24fca107e045_sd_image_opp.png,no,no
"4k happy attractive mixed ethnicity group of friends at glamorous party , drinking champagne and celebrating a special event","4k unhappy attractive mixed ethnicity group of friends at glamorous party , drinking champagne and celebrating a special event",Data/conceptual_captions_data/processed_success/78afc9af-a0a0-4d15-a8b4-d6759c9057a6/78afc9af-a0a0-4d15-a8b4-d6759c9057a6_sd_image.png,Data/conceptual_captions_data/processed_success/78afc9af-a0a0-4d15-a8b4-d6759c9057a6/78afc9af-a0a0-4d15-a8b4-d6759c9057a6_sd_image_opp.png,no,no
"a drawing i did in early development of person , inspired by my good friend and production designer .","a drawing i did in early development of person , inspired by my good foe and production designer .",Data/conceptual_captions_data/processed_success/1f415c52-8c85-40fd-b40d-83efb36e3ed5/1f415c52-8c85-40fd-b40d-83efb36e3ed5_sd_image.png,Data/conceptual_captions_data/processed_success/1f415c52-8c85-40fd-b40d-83efb36e3ed5/1f415c52-8c85-40fd-b40d-83efb36e3ed5_sd_image_opp.png,no,no
"a chicken 's best defense against parasites is a strong , healthy immune system .","a chicken 's worst defense against parasites is a strong , healthy immune system .",Data/conceptual_captions_data/processed_success/c70f9187-82c0-4b77-8837-e3373aaf68a1/c70f9187-82c0-4b77-8837-e3373aaf68a1_sd_image.png,Data/conceptual_captions_data/processed_success/c70f9187-82c0-4b77-8837-e3373aaf68a1/c70f9187-82c0-4b77-8837-e3373aaf68a1_sd_image_opp.png,no,no
the importance of confidence to be successful in weightlifting,the importance of diffidence to be successful in weightlifting,Data/conceptual_captions_data/processed_success/ac60a12e-2dc6-4ef8-a5ac-ef1078f3aba4/ac60a12e-2dc6-4ef8-a5ac-ef1078f3aba4_sd_image.png,Data/conceptual_captions_data/processed_success/ac60a12e-2dc6-4ef8-a5ac-ef1078f3aba4/ac60a12e-2dc6-4ef8-a5ac-ef1078f3aba4_sd_image_opp.png,no,no
happy smiling girl using a smart phone in a city park sitting on a bench .,unhappy smiling girl using a smart phone in a city park sitting on a bench .,Data/conceptual_captions_data/processed_success/635331ab-5c71-411b-a8dd-a88550dad961/635331ab-5c71-411b-a8dd-a88550dad961_sd_image.png,Data/conceptual_captions_data/processed_success/635331ab-5c71-411b-a8dd-a88550dad961/635331ab-5c71-411b-a8dd-a88550dad961_sd_image_opp.png,no,no
"happy elf standing behind a blue banner with snowflakes and western christian holiday and happy new year , illustration .","unhappy elf standing behind a blue banner with snowflakes and western christian holiday and happy new year , illustration .",Data/conceptual_captions_data/processed_success/540e5dfb-fa02-444b-a068-0bc7129c43b7/540e5dfb-fa02-444b-a068-0bc7129c43b7_sd_image.png,Data/conceptual_captions_data/processed_success/540e5dfb-fa02-444b-a068-0bc7129c43b7/540e5dfb-fa02-444b-a068-0bc7129c43b7_sd_image_opp.png,no,no
beautiful little girl enjoying nature on a sunny day .,ugly little girl enjoying nature on a sunny day .,Data/conceptual_captions_data/processed_success/f465521b-8806-4ff4-84ba-28f1dea2888c/f465521b-8806-4ff4-84ba-28f1dea2888c_sd_image.png,Data/conceptual_captions_data/processed_success/f465521b-8806-4ff4-84ba-28f1dea2888c/f465521b-8806-4ff4-84ba-28f1dea2888c_sd_image_opp.png,no,no
actor in a beautiful smile at festival,actor in a ugly smile at festival,Data/conceptual_captions_data/processed_success/71f954ee-a3b1-4cd2-93de-d5e360df51ed/71f954ee-a3b1-4cd2-93de-d5e360df51ed_sd_image.png,Data/conceptual_captions_data/processed_success/71f954ee-a3b1-4cd2-93de-d5e360df51ed/71f954ee-a3b1-4cd2-93de-d5e360df51ed_sd_image_opp.png,no,no
violent confrontation : protestors were seen clashing with riot police in the country 's capital city yesterday,nonviolent confrontation : protestors were seen clashing with riot police in the country 's capital city yesterday,Data/conceptual_captions_data/processed_success/976e02eb-a04e-466f-bd24-bf149cddde66/976e02eb-a04e-466f-bd24-bf149cddde66_sd_image.png,Data/conceptual_captions_data/processed_success/976e02eb-a04e-466f-bd24-bf149cddde66/976e02eb-a04e-466f-bd24-bf149cddde66_sd_image_opp.png,yes,no
"drawing of a dog poking a dead rat with his nose and saying , it 's been dead for a few hours now , which can get a bit boring .","drawing of a dog poking a dead rat with his nose and saying , it 's been dead for a few hours now , which hire get a bit boring .",Data/conceptual_captions_data/processed_success/69dec930-5851-4fb6-9764-c8600bff8a9e/69dec930-5851-4fb6-9764-c8600bff8a9e_sd_image.png,Data/conceptual_captions_data/processed_success/69dec930-5851-4fb6-9764-c8600bff8a9e/69dec930-5851-4fb6-9764-c8600bff8a9e_sd_image_opp.png,no,no
film character saved her own life and now lives on a farm and has goat as a best friend !,film character saved her own life and now lives on a farm and has goat as a best foe !,Data/conceptual_captions_data/processed_success/f6472837-7b0b-4f68-aa40-9891a2cebbc1/f6472837-7b0b-4f68-aa40-9891a2cebbc1_sd_image.png,Data/conceptual_captions_data/processed_success/f6472837-7b0b-4f68-aa40-9891a2cebbc1/f6472837-7b0b-4f68-aa40-9891a2cebbc1_sd_image_opp.png,no,no
show your mama some love this mother 's day with these joyous recipes !,show your mama some hate this mother 's day with these joyous recipes !,Data/conceptual_captions_data/processed_success/1a7d662c-51fe-4ce7-9211-f1d8345e0ca6/1a7d662c-51fe-4ce7-9211-f1d8345e0ca6_sd_image.png,Data/conceptual_captions_data/processed_success/1a7d662c-51fe-4ce7-9211-f1d8345e0ca6/1a7d662c-51fe-4ce7-9211-f1d8345e0ca6_sd_image_opp.png,no,no
"best outing came at the right time , gaining points in the championship .","best outing came at the right time , gaining unpointedness in the championship .",Data/conceptual_captions_data/processed_success/4b98fec0-b9b1-4177-af7d-96ae57407c7f/4b98fec0-b9b1-4177-af7d-96ae57407c7f_sd_image.png,Data/conceptual_captions_data/processed_success/4b98fec0-b9b1-4177-af7d-96ae57407c7f/4b98fec0-b9b1-4177-af7d-96ae57407c7f_sd_image_opp.png,no,no
"travel in winter can be a beautiful or risky experience , but these tips and suggested itinerary can help , graced by beautiful photos !","travel in winter can be a ugly or risky experience , but these tips and suggested itinerary can help , graced by beautiful photos !",Data/conceptual_captions_data/processed_success/bd268b7c-fc41-41c5-b428-7ab6935acef2/bd268b7c-fc41-41c5-b428-7ab6935acef2_sd_image.png,Data/conceptual_captions_data/processed_success/bd268b7c-fc41-41c5-b428-7ab6935acef2/bd268b7c-fc41-41c5-b428-7ab6935acef2_sd_image_opp.png,no,no
greetings cards for birthday - i wish you all the happiness in the world !,greetings cards for birthday - i begrudge you all the happiness in the world !,Data/conceptual_captions_data/processed_success/ba7c104c-9654-44a7-8a69-f94923c7da55/ba7c104c-9654-44a7-8a69-f94923c7da55_sd_image.png,Data/conceptual_captions_data/processed_success/ba7c104c-9654-44a7-8a69-f94923c7da55/ba7c104c-9654-44a7-8a69-f94923c7da55_sd_image_opp.png,no,no
portrait of happy young friends in cafe and looking at the photos on smart phone .,portrait of unhappy young friends in cafe and looking at the photos on smart phone .,Data/conceptual_captions_data/processed_success/e58f5cde-3e6f-4ee7-86fb-5a6f14af2974/e58f5cde-3e6f-4ee7-86fb-5a6f14af2974_sd_image.png,Data/conceptual_captions_data/processed_success/e58f5cde-3e6f-4ee7-86fb-5a6f14af2974/e58f5cde-3e6f-4ee7-86fb-5a6f14af2974_sd_image_opp.png,no,no
"portrait of happy young woman with beautiful curly hair smiling in the city , slow motion","portrait of unhappy young woman with beautiful curly hair smiling in the city , slow motion",Data/conceptual_captions_data/processed_success/0d326a18-ec23-4950-a000-f29d2cb08f61/0d326a18-ec23-4950-a000-f29d2cb08f61_sd_image.png,Data/conceptual_captions_data/processed_success/0d326a18-ec23-4950-a000-f29d2cb08f61/0d326a18-ec23-4950-a000-f29d2cb08f61_sd_image_opp.png,no,no
nothing like a mother 's love : actor has shared an adorable image of herself and person cuddling up closely and displaying identical smiles to social media,nothing like a mother 's hate : actor has shared an adorable image of herself and person cuddling up closely and displaying identical smiles to social media,Data/conceptual_captions_data/processed_success/6eedb5c2-3232-46a4-a839-34ee4e8e50d8/6eedb5c2-3232-46a4-a839-34ee4e8e50d8_sd_image.png,Data/conceptual_captions_data/processed_success/6eedb5c2-3232-46a4-a839-34ee4e8e50d8/6eedb5c2-3232-46a4-a839-34ee4e8e50d8_sd_image_opp.png,no,no
a woman is dead and her son injured after a car accident .,a woman is dead and her son uninjured after a car accident .,Data/conceptual_captions_data/processed_success/bc0ff283-47c3-4779-b5e1-c1d41b64bb78/bc0ff283-47c3-4779-b5e1-c1d41b64bb78_sd_image.png,Data/conceptual_captions_data/processed_success/bc0ff283-47c3-4779-b5e1-c1d41b64bb78/bc0ff283-47c3-4779-b5e1-c1d41b64bb78_sd_image_opp.png,yes,no
find out how a beautiful entrance gate can further secure your home while creating a grand entrance .,find safe how a beautiful entrance gate can further secure your home while creating a grand entrance .,Data/conceptual_captions_data/processed_success/34d7c76a-4e6a-4413-b270-3583565ba827/34d7c76a-4e6a-4413-b270-3583565ba827_sd_image.png,Data/conceptual_captions_data/processed_success/34d7c76a-4e6a-4413-b270-3583565ba827/34d7c76a-4e6a-4413-b270-3583565ba827_sd_image_opp.png,no,no
probably when i was about one but this is the closest i had on hand to baby me :),incredibly when i was about one but this is the closest i had on hand to baby me :),Data/conceptual_captions_data/processed_success/07472083-daa2-44ee-9ce6-20a46007bba5/07472083-daa2-44ee-9ce6-20a46007bba5_sd_image.png,Data/conceptual_captions_data/processed_success/07472083-daa2-44ee-9ce6-20a46007bba5/07472083-daa2-44ee-9ce6-20a46007bba5_sd_image_opp.png,no,no
abstract hand - painted white hearts on pink banner set with i love you and once upon a time calligraphic inscription for invitation or greeting cards,abstract hand - painted white hearts on pink banner set with i hate you and once upon a time calligraphic inscription for invitation or greeting cards,Data/conceptual_captions_data/processed_success/59419145-2baa-4e94-8417-34958b577173/59419145-2baa-4e94-8417-34958b577173_sd_image.png,Data/conceptual_captions_data/processed_success/59419145-2baa-4e94-8417-34958b577173/59419145-2baa-4e94-8417-34958b577173_sd_image_opp.png,no,no
modern combinations with blazers that you will love to copy - love the hot pink blazer !,modern combinations with blazers that you will hate to copy - love the hot pink blazer !,Data/conceptual_captions_data/processed_success/cdc61d06-06ff-485e-9d7a-6e16e72431b2/cdc61d06-06ff-485e-9d7a-6e16e72431b2_sd_image.png,Data/conceptual_captions_data/processed_success/cdc61d06-06ff-485e-9d7a-6e16e72431b2/cdc61d06-06ff-485e-9d7a-6e16e72431b2_sd_image_opp.png,no,no
look at the size of those beautiful paws so prominently displayed - marvelous creature !,look at the size of those ugly paws so prominently displayed - marvelous creature !,Data/conceptual_captions_data/processed_success/a1e5c5c5-7b45-43c0-8737-86bebcb2d1d7/a1e5c5c5-7b45-43c0-8737-86bebcb2d1d7_sd_image.png,Data/conceptual_captions_data/processed_success/a1e5c5c5-7b45-43c0-8737-86bebcb2d1d7/a1e5c5c5-7b45-43c0-8737-86bebcb2d1d7_sd_image_opp.png,no,no
"animal , died several weeks ago after ingesting a poisonous mushroom which killed her within hours .","animal , be_born several weeks ago after ingesting a poisonous mushroom which killed her within hours .",Data/conceptual_captions_data/processed_success/111a5785-95e2-4ea3-a8f7-09643bfde607/111a5785-95e2-4ea3-a8f7-09643bfde607_sd_image.png,Data/conceptual_captions_data/processed_success/111a5785-95e2-4ea3-a8f7-09643bfde607/111a5785-95e2-4ea3-a8f7-09643bfde607_sd_image_opp.png,no,no
