caption,caption_opp,image_path,image_opp_path,classifier_equivalence,classifier_equivalence_opp
"for $810 , i would not have thought this was a good deal , but a clean , modern hotel room just asking to be slept in for the cost of $0 is a warm and welcome sight .","for $810 , i would not have thought this was a good deal , but a clean , modern hotel room just asking to be slept in for the cost of $0 is a cool and welcome sight .",Data/conceptual_captions_data/processed_success/7532c471-656d-4697-9015-13e5a67538db/7532c471-656d-4697-9015-13e5a67538db_sd_image.png,Data/conceptual_captions_data/processed_success/7532c471-656d-4697-9015-13e5a67538db/7532c471-656d-4697-9015-13e5a67538db_sd_image_opp.png,no,no
champions : the likes of footballer and soccer player have found success under businessperson,champions : the dislike of footballer and soccer player have found success under businessperson,Data/conceptual_captions_data/processed_success/e68c71f7-2a86-4a73-9304-b11f53d9ea18/e68c71f7-2a86-4a73-9304-b11f53d9ea18_sd_image.png,Data/conceptual_captions_data/processed_success/e68c71f7-2a86-4a73-9304-b11f53d9ea18/e68c71f7-2a86-4a73-9304-b11f53d9ea18_sd_image_opp.png,no,no
"happy valentines day background , greeting card or gift card with silhouette of a girl giving flying kiss .","unhappy valentines day background , greeting card or gift card with silhouette of a girl giving flying kiss .",Data/conceptual_captions_data/processed_success/68be081f-dc2d-4a44-9d4f-f1ad5449dfbb/68be081f-dc2d-4a44-9d4f-f1ad5449dfbb_sd_image.png,Data/conceptual_captions_data/processed_success/68be081f-dc2d-4a44-9d4f-f1ad5449dfbb/68be081f-dc2d-4a44-9d4f-f1ad5449dfbb_sd_image_opp.png,no,no
"on the left side of a strong woman , stands a strong man ; he is strengthened by her character .","on the left side of a weak woman , stands a strong man ; he is strengthened by her character .",Data/conceptual_captions_data/processed_success/06203f18-674e-440f-8a34-74dd7ddb469a/06203f18-674e-440f-8a34-74dd7ddb469a_sd_image.png,Data/conceptual_captions_data/processed_success/06203f18-674e-440f-8a34-74dd7ddb469a/06203f18-674e-440f-8a34-74dd7ddb469a_sd_image_opp.png,no,no
having fun : the former star certainly looked like he was enjoying himself,having fun : the former star certainly looked like he was suffer himself,Data/conceptual_captions_data/processed_success/584bdea1-8a0b-4146-8b76-ac6eb6aa24a5/584bdea1-8a0b-4146-8b76-ac6eb6aa24a5_sd_image.png,Data/conceptual_captions_data/processed_success/584bdea1-8a0b-4146-8b76-ac6eb6aa24a5/584bdea1-8a0b-4146-8b76-ac6eb6aa24a5_sd_image_opp.png,no,no
"film character is on the way and u might just get lucky western christian holiday , so be ready with your wish !","film character is on the way and u might just get lucky western christian holiday , so be ready with your begrudge !",Data/conceptual_captions_data/processed_success/6636c252-6cbd-456e-b337-0eb4962badae/6636c252-6cbd-456e-b337-0eb4962badae_sd_image.png,Data/conceptual_captions_data/processed_success/6636c252-6cbd-456e-b337-0eb4962badae/6636c252-6cbd-456e-b337-0eb4962badae_sd_image_opp.png,no,no
smiles all round : the pair 's joy was clear to see as they smiled their way through the crowds,smiles all round : the pair 's sorrow was clear to see as they smiled their way through the crowds,Data/conceptual_captions_data/processed_success/9cbf32d1-bc59-4367-a82d-fa7ae2b37cd7/9cbf32d1-bc59-4367-a82d-fa7ae2b37cd7_sd_image.png,Data/conceptual_captions_data/processed_success/9cbf32d1-bc59-4367-a82d-fa7ae2b37cd7/9cbf32d1-bc59-4367-a82d-fa7ae2b37cd7_sd_image_opp.png,no,no
joy in every season : walking with friends through engagement,sorrow in every season : walking with friends through engagement,Data/conceptual_captions_data/processed_success/f303017f-0793-4ef0-b60a-6b30cbecd691/f303017f-0793-4ef0-b60a-6b30cbecd691_sd_image.png,Data/conceptual_captions_data/processed_success/f303017f-0793-4ef0-b60a-6b30cbecd691/f303017f-0793-4ef0-b60a-6b30cbecd691_sd_image_opp.png,no,no
happy family of 4 enjoying some fresh air and a walk .,unhappy family of 4 enjoying some fresh air and a walk .,Data/conceptual_captions_data/processed_success/434694ee-6dff-4dfb-be38-c7298baf64d0/434694ee-6dff-4dfb-be38-c7298baf64d0_sd_image.png,Data/conceptual_captions_data/processed_success/434694ee-6dff-4dfb-be38-c7298baf64d0/434694ee-6dff-4dfb-be38-c7298baf64d0_sd_image_opp.png,no,no
soft pink walls and white floors create a calming and bright setting for a sunny interior look .,soft pink walls and white floors create a agitate and bright setting for a sunny interior look .,Data/conceptual_captions_data/processed_success/5bbaa6e5-b865-4f77-b676-0a39144002ee/5bbaa6e5-b865-4f77-b676-0a39144002ee_sd_image.png,Data/conceptual_captions_data/processed_success/5bbaa6e5-b865-4f77-b676-0a39144002ee/5bbaa6e5-b865-4f77-b676-0a39144002ee_sd_image_opp.png,no,no
the best and most beautiful things in the world can not be seen or even touched - they must be felt with the heart .,the best and most ugly things in the world can not be seen or even touched - they must be felt with the heart .,Data/conceptual_captions_data/processed_success/9056fc66-3c37-4cd4-9467-e68aef425459/9056fc66-3c37-4cd4-9467-e68aef425459_sd_image.png,Data/conceptual_captions_data/processed_success/9056fc66-3c37-4cd4-9467-e68aef425459/9056fc66-3c37-4cd4-9467-e68aef425459_sd_image_opp.png,no,no
themes of love and romance blended together in play,themes of love and romance blended together in tightness,Data/conceptual_captions_data/processed_success/750ee46e-7d96-4a50-a545-0920f38a2bb4/750ee46e-7d96-4a50-a545-0920f38a2bb4_sd_image.png,Data/conceptual_captions_data/processed_success/750ee46e-7d96-4a50-a545-0920f38a2bb4/750ee46e-7d96-4a50-a545-0920f38a2bb4_sd_image_opp.png,no,no
greetings cards for birthday - hope you have the brightest of birthdays !,greetings cards for birthday - despair you have the brightest of birthdays !,Data/conceptual_captions_data/processed_success/e5262648-45eb-4478-b900-01cb96d8f21a/e5262648-45eb-4478-b900-01cb96d8f21a_sd_image.png,Data/conceptual_captions_data/processed_success/e5262648-45eb-4478-b900-01cb96d8f21a/e5262648-45eb-4478-b900-01cb96d8f21a_sd_image_opp.png,no,no
family member and her family are a vision of joy and happiness in the official photographs from her christening .,family member and her family are a vision of sorrow and happiness in the official photographs from her christening .,Data/conceptual_captions_data/processed_success/fbd411a2-f745-4cc9-97d6-aa0e453bbce2/fbd411a2-f745-4cc9-97d6-aa0e453bbce2_sd_image.png,Data/conceptual_captions_data/processed_success/fbd411a2-f745-4cc9-97d6-aa0e453bbce2/fbd411a2-f745-4cc9-97d6-aa0e453bbce2_sd_image_opp.png,no,no
"ss we all know , animal are perhaps the most beautiful birds existing , we often describe them as gracious and proud creatures .","ss we all know , animal are perhaps the most ugly birds existing , we often describe them as gracious and proud creatures .",Data/conceptual_captions_data/processed_success/96977009-d7d9-484f-8150-ac1da37f7036/96977009-d7d9-484f-8150-ac1da37f7036_sd_image.png,Data/conceptual_captions_data/processed_success/96977009-d7d9-484f-8150-ac1da37f7036/96977009-d7d9-484f-8150-ac1da37f7036_sd_image_opp.png,no,no
young high school student couple hugging romantically with love at the park,young high school student couple hugging romantically with hate at the park,Data/conceptual_captions_data/processed_success/91259f07-7384-41b0-a6ad-47f4b8828e09/91259f07-7384-41b0-a6ad-47f4b8828e09_sd_image.png,Data/conceptual_captions_data/processed_success/91259f07-7384-41b0-a6ad-47f4b8828e09/91259f07-7384-41b0-a6ad-47f4b8828e09_sd_image_opp.png,no,no
happy together : the two shared a laugh in the water,unhappy together : the two shared a laugh in the water,Data/conceptual_captions_data/processed_success/c2d10a5c-a5d5-407e-a3f3-b1926e65c5cc/c2d10a5c-a5d5-407e-a3f3-b1926e65c5cc_sd_image.png,Data/conceptual_captions_data/processed_success/c2d10a5c-a5d5-407e-a3f3-b1926e65c5cc/c2d10a5c-a5d5-407e-a3f3-b1926e65c5cc_sd_image_opp.png,no,no
socialite is spotted enjoying a fun filled day on the beach with her children and friends,socialite is spotted suffer a fun filled day on the beach with her children and friends,Data/conceptual_captions_data/processed_success/b60a9de0-a6c4-4207-80b9-c4006d51d829/b60a9de0-a6c4-4207-80b9-c4006d51d829_sd_image.png,Data/conceptual_captions_data/processed_success/b60a9de0-a6c4-4207-80b9-c4006d51d829/b60a9de0-a6c4-4207-80b9-c4006d51d829_sd_image_opp.png,no,no
hand drawn beautiful cute little girls with person bears on the background with the inscription best friends .,hand drawn beautiful cute little girls with person bears on the background with the inscription best foe .,Data/conceptual_captions_data/processed_success/f8f27563-6612-4750-985b-d60a1d1591c8/f8f27563-6612-4750-985b-d60a1d1591c8_sd_image.png,Data/conceptual_captions_data/processed_success/f8f27563-6612-4750-985b-d60a1d1591c8/f8f27563-6612-4750-985b-d60a1d1591c8_sd_image_opp.png,no,no
"an example of how happiness affects family life is that happy people tended to have happier marriages , leading to them having more successful marriages .","an example of how unhappiness affects family life is that happy people tended to have happier marriages , leading to them having more successful marriages .",Data/conceptual_captions_data/processed_success/59a709c4-9d18-4f16-b1f5-cb366d59969e/59a709c4-9d18-4f16-b1f5-cb366d59969e_sd_image.png,Data/conceptual_captions_data/processed_success/59a709c4-9d18-4f16-b1f5-cb366d59969e/59a709c4-9d18-4f16-b1f5-cb366d59969e_sd_image_opp.png,no,no
image of best friends using mobile or smart phones at home .,image of best foe using mobile or smart phones at home .,Data/conceptual_captions_data/processed_success/4540e0e3-2acb-4ce6-8819-ef58455de91a/4540e0e3-2acb-4ce6-8819-ef58455de91a_sd_image.png,Data/conceptual_captions_data/processed_success/4540e0e3-2acb-4ce6-8819-ef58455de91a/4540e0e3-2acb-4ce6-8819-ef58455de91a_sd_image_opp.png,no,no
"young caucasian bearded businessman in grey sweatshirt sitting behind his desk and using smart phone , working in a bright office with a white brick wall looking confident satisfied and successful","young caucasian bearded businessman in grey sweatshirt sitting behind his desk and using smart phone , working in a bright office with a white brick wall looking confident fall_short_of and successful",Data/conceptual_captions_data/processed_success/4362fe4d-bdb9-4780-9876-a48e32688107/4362fe4d-bdb9-4780-9876-a48e32688107_sd_image.png,Data/conceptual_captions_data/processed_success/4362fe4d-bdb9-4780-9876-a48e32688107/4362fe4d-bdb9-4780-9876-a48e32688107_sd_image_opp.png,no,no
cartoonist shares a portfolio of her wise and funny cartoons about modern life -- and talks about how humor can empower women to change the rules .,cartoonist shares a portfolio of her wise and funny cartoons about modern life -- and keep_quiet about how humor can empower women to change the rules .,Data/conceptual_captions_data/processed_success/ed562485-cf43-49c7-9311-e459654d24f1/ed562485-cf43-49c7-9311-e459654d24f1_sd_image.png,Data/conceptual_captions_data/processed_success/ed562485-cf43-49c7-9311-e459654d24f1/ed562485-cf43-49c7-9311-e459654d24f1_sd_image_opp.png,no,no
"texture : the beauty slipped into a grey , hip - hugging gown that featured a dazzling array of jewels across her chest and shoulders","texture : the ugliness slipped into a grey , hip - hugging gown that featured a dazzling array of jewels across her chest and shoulders",Data/conceptual_captions_data/processed_success/6c729335-4782-4554-8c88-9c1907ec2572/6c729335-4782-4554-8c88-9c1907ec2572_sd_image.png,Data/conceptual_captions_data/processed_success/6c729335-4782-4554-8c88-9c1907ec2572/6c729335-4782-4554-8c88-9c1907ec2572_sd_image_opp.png,no,no
"vivacious beautiful young women in trendy short summer dresses posing arm in arm balanced on foot smiling at the camera , full length studio portrait","vivacious ugly young women in trendy short summer dresses posing arm in arm balanced on foot smiling at the camera , full length studio portrait",Data/conceptual_captions_data/processed_success/98dfd329-cef3-4b6b-80d0-63f18f57faff/98dfd329-cef3-4b6b-80d0-63f18f57faff_sd_image.png,Data/conceptual_captions_data/processed_success/98dfd329-cef3-4b6b-80d0-63f18f57faff/98dfd329-cef3-4b6b-80d0-63f18f57faff_sd_image_opp.png,no,no
tourist attractions is just one of many obvious reasons to love island shown in this beautiful video .,tourist attractions is just one of many obvious reasons to love island shown in this ugly video .,Data/conceptual_captions_data/processed_success/699c69b9-8b4d-4193-84f7-a2de27993683/699c69b9-8b4d-4193-84f7-a2de27993683_sd_image.png,Data/conceptual_captions_data/processed_success/699c69b9-8b4d-4193-84f7-a2de27993683/699c69b9-8b4d-4193-84f7-a2de27993683_sd_image_opp.png,yes,no
angry couple arguing behind a sad girl stock picture,unangry couple arguing behind a sad girl stock picture,Data/conceptual_captions_data/processed_success/cd8f41e4-177c-47e6-930b-bad67e01e54e/cd8f41e4-177c-47e6-930b-bad67e01e54e_sd_image.png,Data/conceptual_captions_data/processed_success/cd8f41e4-177c-47e6-930b-bad67e01e54e/cd8f41e4-177c-47e6-930b-bad67e01e54e_sd_image_opp.png,no,no
"attractive young couple walk into shot , hug , sit , laugh and talk while embracing on a date in park .","attractive young couple walk into shot , hug , sit , cry and talk while embracing on a date in park .",Data/conceptual_captions_data/processed_success/3e4d6e9d-0a33-4170-8718-8238e40e2863/3e4d6e9d-0a33-4170-8718-8238e40e2863_sd_image.png,Data/conceptual_captions_data/processed_success/3e4d6e9d-0a33-4170-8718-8238e40e2863/3e4d6e9d-0a33-4170-8718-8238e40e2863_sd_image_opp.png,no,no
"low angle view of several trunks of oak trees standing next to each other on a beautiful sunny springtime day , german forest at it 's best","low angle view of several trunks of oak trees standing next to each other on a beautiful sunny springtime day , german forest at it 's worst",Data/conceptual_captions_data/processed_success/2f44e5b9-99e9-4c39-aaa0-f9285343216c/2f44e5b9-99e9-4c39-aaa0-f9285343216c_sd_image.png,Data/conceptual_captions_data/processed_success/2f44e5b9-99e9-4c39-aaa0-f9285343216c/2f44e5b9-99e9-4c39-aaa0-f9285343216c_sd_image_opp.png,no,no
happy sunday good morning wishing you a day filled with love,happy sunday good morning begrudge you a day filled with love,Data/conceptual_captions_data/processed_success/a2889df6-ebbe-4458-bb98-5b7f1230ceef/a2889df6-ebbe-4458-bb98-5b7f1230ceef_sd_image.png,Data/conceptual_captions_data/processed_success/a2889df6-ebbe-4458-bb98-5b7f1230ceef/a2889df6-ebbe-4458-bb98-5b7f1230ceef_sd_image_opp.png,no,no
here we have a beautiful cross stitch pattern of wading birds doing what they do best : standing around on leg and minding their own business !,here we have a ugly cross stitch pattern of wading birds doing what they do best : standing around on leg and minding their own business !,Data/conceptual_captions_data/processed_success/d9a44180-732e-45cb-a10b-270a71812726/d9a44180-732e-45cb-a10b-270a71812726_sd_image.png,Data/conceptual_captions_data/processed_success/d9a44180-732e-45cb-a10b-270a71812726/d9a44180-732e-45cb-a10b-270a71812726_sd_image_opp.png,no,no
behind every successful woman is a best friend giving her crazy ideas !,behind every successful woman is a best foe giving her crazy ideas !,Data/conceptual_captions_data/processed_success/9900122e-5096-487a-8628-9149f6466d03/9900122e-5096-487a-8628-9149f6466d03_sd_image.png,Data/conceptual_captions_data/processed_success/9900122e-5096-487a-8628-9149f6466d03/9900122e-5096-487a-8628-9149f6466d03_sd_image_opp.png,no,no
"engagement ring with a brilliant , hand -- selected diamond .","engagement open_chain with a brilliant , hand -- selected diamond .",Data/conceptual_captions_data/processed_success/506e9a52-e795-4951-87da-9798dce0ac16/506e9a52-e795-4951-87da-9798dce0ac16_sd_image.png,Data/conceptual_captions_data/processed_success/506e9a52-e795-4951-87da-9798dce0ac16/506e9a52-e795-4951-87da-9798dce0ac16_sd_image_opp.png,no,no
interest has gone back to basics with a winning formula for success .,interest has gone back to basics with a lose formula for success .,Data/conceptual_captions_data/processed_success/29ea4d61-667f-496b-818a-a4ca1eb42f3c/29ea4d61-667f-496b-818a-a4ca1eb42f3c_sd_image.png,Data/conceptual_captions_data/processed_success/29ea4d61-667f-496b-818a-a4ca1eb42f3c/29ea4d61-667f-496b-818a-a4ca1eb42f3c_sd_image_opp.png,no,no
"to honor single , and a reminder to everyone to just hold on. :) lyrics single positive quote","to dishonor single , and a reminder to everyone to just hold on. :) lyrics single positive quote",Data/conceptual_captions_data/processed_success/187d4265-feea-400d-94d4-c0d2d73a674e/187d4265-feea-400d-94d4-c0d2d73a674e_sd_image.png,Data/conceptual_captions_data/processed_success/187d4265-feea-400d-94d4-c0d2d73a674e/187d4265-feea-400d-94d4-c0d2d73a674e_sd_image_opp.png,no,no
did you know that is ? celebrate one of the world 's most intelligent animals with some of these creative crafts !,did you know that is ? celebrate one of the world 's most intelligent animals with some of these uncreative crafts !,Data/conceptual_captions_data/processed_success/d6d3cb75-495e-40db-9946-9a9d6572ef2f/d6d3cb75-495e-40db-9946-9a9d6572ef2f_sd_image.png,Data/conceptual_captions_data/processed_success/d6d3cb75-495e-40db-9946-9a9d6572ef2f/d6d3cb75-495e-40db-9946-9a9d6572ef2f_sd_image_opp.png,no,no
natural beauty : actor stepped out make - up free as she hit the shops on tuesday,natural ugliness : actor stepped out make - up free as she hit the shops on tuesday,Data/conceptual_captions_data/processed_success/e6bbc6e8-dec0-49c7-8fbd-72b532d4a132/e6bbc6e8-dec0-49c7-8fbd-72b532d4a132_sd_image.png,Data/conceptual_captions_data/processed_success/e6bbc6e8-dec0-49c7-8fbd-72b532d4a132/e6bbc6e8-dec0-49c7-8fbd-72b532d4a132_sd_image_opp.png,no,no
"hand painted signs perched in trees , with ivy growing up the wall , this little yard looks like the perfect place for a traveling artist to post up .","hand painted signs perched in trees , with ivy growing up the wall , this little yard looks like the imperfect place for a traveling artist to post up .",Data/conceptual_captions_data/processed_success/7a53938a-9b76-47ce-b2ca-acd0648a814f/7a53938a-9b76-47ce-b2ca-acd0648a814f_sd_image.png,Data/conceptual_captions_data/processed_success/7a53938a-9b76-47ce-b2ca-acd0648a814f/7a53938a-9b76-47ce-b2ca-acd0648a814f_sd_image_opp.png,no,no
care free : the rest of face was make - up free and she appeared completely relaxed and happy,care free : the rest of face was make - up free and she appeared completely relaxed and unhappy,Data/conceptual_captions_data/processed_success/d288bb3a-52f6-4b40-8f8e-de1c9a2b5b8f/d288bb3a-52f6-4b40-8f8e-de1c9a2b5b8f_sd_image.png,Data/conceptual_captions_data/processed_success/d288bb3a-52f6-4b40-8f8e-de1c9a2b5b8f/d288bb3a-52f6-4b40-8f8e-de1c9a2b5b8f_sd_image_opp.png,no,no
an attractive couple kiss and hug overlooking the ocean at sunset in a tropical paradise,an unattractive couple kiss and hug overlooking the ocean at sunset in a tropical paradise,Data/conceptual_captions_data/processed_success/b91a0869-5e9d-4e50-b3ff-2cbccd8c8d5e/b91a0869-5e9d-4e50-b3ff-2cbccd8c8d5e_sd_image.png,Data/conceptual_captions_data/processed_success/b91a0869-5e9d-4e50-b3ff-2cbccd8c8d5e/b91a0869-5e9d-4e50-b3ff-2cbccd8c8d5e_sd_image_opp.png,no,no
"vibrant communities are built upon the values of social , economic , and environmental justice .","vibrant communities are built upon the disrespect of social , economic , and environmental justice .",Data/conceptual_captions_data/processed_success/a3f14eff-06b9-4a2b-b591-79506eb30bbe/a3f14eff-06b9-4a2b-b591-79506eb30bbe_sd_image.png,Data/conceptual_captions_data/processed_success/a3f14eff-06b9-4a2b-b591-79506eb30bbe/a3f14eff-06b9-4a2b-b591-79506eb30bbe_sd_image_opp.png,no,no
"beautiful female college student holding her books smiling , education , campus and teenage concept , teenage girl using smart phone on the back","ugly female college student holding her books smiling , education , campus and teenage concept , teenage girl using smart phone on the back",Data/conceptual_captions_data/processed_success/ce212ce2-815a-40f2-a731-3f10fdffd932/ce212ce2-815a-40f2-a731-3f10fdffd932_sd_image.png,Data/conceptual_captions_data/processed_success/ce212ce2-815a-40f2-a731-3f10fdffd932/ce212ce2-815a-40f2-a731-3f10fdffd932_sd_image_opp.png,no,no
attractive man holding flag in his hands on the back walking in the green field and smiling proudly .,unattractive man holding flag in his hands on the back walking in the green field and smiling proudly .,Data/conceptual_captions_data/processed_success/38302adf-80da-43ff-bf28-0eff0dcb1334/38302adf-80da-43ff-bf28-0eff0dcb1334_sd_image.png,Data/conceptual_captions_data/processed_success/38302adf-80da-43ff-bf28-0eff0dcb1334/38302adf-80da-43ff-bf28-0eff0dcb1334_sd_image_opp.png,no,no
"fresh , farmer , young carrots with a beautiful tops on a black painted wooden background","stale , farmer , young carrots with a beautiful tops on a black painted wooden background",Data/conceptual_captions_data/processed_success/546b0383-74db-4d95-b3c4-a7eebf96e502/546b0383-74db-4d95-b3c4-a7eebf96e502_sd_image.png,Data/conceptual_captions_data/processed_success/546b0383-74db-4d95-b3c4-a7eebf96e502/546b0383-74db-4d95-b3c4-a7eebf96e502_sd_image_opp.png,no,no
"pretty smiling young girl relaxing at home , she is sitting on the sofa in the living room and reading a magazine","unreasonably smiling young girl relaxing at home , she is sitting on the sofa in the living room and reading a magazine",Data/conceptual_captions_data/processed_success/a8ff8bb8-14f8-4403-b4c2-2660b1e41047/a8ff8bb8-14f8-4403-b4c2-2660b1e41047_sd_image.png,Data/conceptual_captions_data/processed_success/a8ff8bb8-14f8-4403-b4c2-2660b1e41047/a8ff8bb8-14f8-4403-b4c2-2660b1e41047_sd_image_opp.png,no,no
"happy couple , sitting near the new year tree and tying bow on gift birthday gift present or new year present","unhappy couple , sitting near the new year tree and tying bow on gift birthday gift present or new year present",Data/conceptual_captions_data/processed_success/b0933ac4-e65e-4024-8982-b26f01b7643a/b0933ac4-e65e-4024-8982-b26f01b7643a_sd_image.png,Data/conceptual_captions_data/processed_success/b0933ac4-e65e-4024-8982-b26f01b7643a/b0933ac4-e65e-4024-8982-b26f01b7643a_sd_image_opp.png,no,no
hispanic beautiful woman cooking in modern kitchen smiling happily while cutting a tomato on wooden board with other,hispanic ugly woman cooking in modern kitchen smiling happily while cutting a tomato on wooden board with other,Data/conceptual_captions_data/processed_success/fe40a3d6-c5fb-411a-aac0-611b9337184b/fe40a3d6-c5fb-411a-aac0-611b9337184b_sd_image.png,Data/conceptual_captions_data/processed_success/fe40a3d6-c5fb-411a-aac0-611b9337184b/fe40a3d6-c5fb-411a-aac0-611b9337184b_sd_image_opp.png,no,no
person seamed sheath dress is perfect for going from work to holiday parties !,person seamed sheath dress is imperfect for going from work to holiday parties !,Data/conceptual_captions_data/processed_success/348f839f-6dd4-4e73-8119-ec9853fdbb33/348f839f-6dd4-4e73-8119-ec9853fdbb33_sd_image.png,Data/conceptual_captions_data/processed_success/348f839f-6dd4-4e73-8119-ec9853fdbb33/348f839f-6dd4-4e73-8119-ec9853fdbb33_sd_image_opp.png,no,no
children 's footprint and name tattoo ... what is wrong with me ... this would hurt like hell .,children 's footprint and name tattoo ... what is right with me ... this would hurt like hell .,Data/conceptual_captions_data/processed_success/c807101e-8a3d-48a1-aeea-06b3de3f71d6/c807101e-8a3d-48a1-aeea-06b3de3f71d6_sd_image.png,Data/conceptual_captions_data/processed_success/c807101e-8a3d-48a1-aeea-06b3de3f71d6/c807101e-8a3d-48a1-aeea-06b3de3f71d6_sd_image_opp.png,no,no
celebrity finishes strong on the 18th hole to win award winner on sunday .,infamy finishes strong on the 18th hole to win award winner on sunday .,Data/conceptual_captions_data/processed_success/b75c7563-5c14-48e0-b5b3-7c877fcc98e9/b75c7563-5c14-48e0-b5b3-7c877fcc98e9_sd_image.png,Data/conceptual_captions_data/processed_success/b75c7563-5c14-48e0-b5b3-7c877fcc98e9/b75c7563-5c14-48e0-b5b3-7c877fcc98e9_sd_image_opp.png,no,no
famous faces : the fans played their part as award winner took on constitutional republic,famous avoid : the fans played their part as award winner took on constitutional republic,Data/conceptual_captions_data/processed_success/7db821e0-57fb-4885-9425-194f740ba4b5/7db821e0-57fb-4885-9425-194f740ba4b5_sd_image.png,Data/conceptual_captions_data/processed_success/7db821e0-57fb-4885-9425-194f740ba4b5/7db821e0-57fb-4885-9425-194f740ba4b5_sd_image_opp.png,yes,no
happy little toddler girl running through a fountain having fun with water splashes in a swimming pool enjoying,unhappy little toddler girl running through a fountain having fun with water splashes in a swimming pool enjoying,Data/conceptual_captions_data/processed_success/38e226d3-17f1-4a7c-a055-a9ccaca48d5b/38e226d3-17f1-4a7c-a055-a9ccaca48d5b_sd_image.png,Data/conceptual_captions_data/processed_success/38e226d3-17f1-4a7c-a055-a9ccaca48d5b/38e226d3-17f1-4a7c-a055-a9ccaca48d5b_sd_image_opp.png,no,no
the illustration of beautiful hand drawn oranges and lemons on a textured background in fresh and juicy style .,the illustration of ugly hand drawn oranges and lemons on a textured background in fresh and juicy style .,Data/conceptual_captions_data/processed_success/caac4151-5e0c-4ef7-bab4-9bedef8a4c9a/caac4151-5e0c-4ef7-bab4-9bedef8a4c9a_sd_image.png,Data/conceptual_captions_data/processed_success/caac4151-5e0c-4ef7-bab4-9bedef8a4c9a/caac4151-5e0c-4ef7-bab4-9bedef8a4c9a_sd_image_opp.png,no,no
